subreddit,permalink,score,num_comments,title,body_text,image_url
IndianStartups,https://old.reddit.com/r/indianstartups/comments/1jy6a6v/this_guy_finally_cracked_the_indian_startup_scene/,5518,93,This guy finally cracked the indian startup scene. Kudos to him for triggering the whole linkedin with one post 😁😉,,https://i.redd.it/yb986nteglue1.png
IndianStartups,https://old.reddit.com/r/indianstartups/comments/1kq6r9g/there_are_very_valid_reasons_that_indian_managers/,5092,161,There are very valid reasons that Indian managers are not respected anywhere in the world. One of them is this attitude:,,https://i.redd.it/kwxtjq8jap1f1.png
IndianStartups,https://old.reddit.com/r/indianstartups/comments/1pnyg1b/amazon_delivery_goon_steals_imac_and_says_nahi/,4927,242,"Amazon delivery goon steals iMac and says ""Nahi milega, Bhool Jao""","TL;DR: Amazon delivery driver named
Laddu Tabrez
first refused to leave my iMac with security on a Saturday, then returned on a weekday, heckled my entire team while we were on deadline, and refused to deliver the device. When I confronted him, he told me harshly to ""forget about it.""
My team's on a tight deadline and desperately needed a new iMac, which Amazon has now failed to deliver twice because of the truly bizarre and hostile actions of one delivery guy. The first attempt was last Saturday. I wasn't in the office, but we have security staff available for package acceptance. This guy flat out refused to leave the high-value item with them, creating a large, unnecessary disturbance with his unprofessional loudness before marking the item as ""undeliverable."" This initial refusal immediately put me behind schedule and forced me to re-order the critical equipment.
I quickly placed the second order, hoping to salvage my week, only to be horrified when the exact same guy showed up. He immediately started his routine again, making a huge ruckus being loud, harassing, and generally disruptive. His actions took unnecessary liberty, severely disturbing both my entire team, who were on a tight deadline, and the office staff too. I had to stop working and personally confront him about the delivery, explaining the urgency and the fact that this was the second attempt caused by his previous non-delivery.
His response was simply shocking. He maintained a harsh, and utterly unprofessional tone and told me directly to ""forget about it"" ""Bhool jao, nahi milega"". He then refused to hand over the iMac and promptly left. I'm now facing serious delays in my business operations and team productivity, all due to the targeted malice and staggering unprofessionalism of one delivery agent. I’ve reported this to Amazon, but the idea of re-ordering a third time with the risk of him showing up again is stressing me out. Does anyone have advice on how to force Amazon to handle this targeted harassment and finally get my essential equipment?
EDIT: Left out a crucial detail, the order was marked ""Returned"" and I had not idea when/ how this happened because I never refused delivery. All this violence BS happened when I called the delivery agent's number from the Amazon-order tracking portal, and the guy who came was apparently his brother or whatever. This guy has never even stepped foot near my office to deliver the thing. And we've filed a police complaint against this miscreant. Hoping for justice soon.",https://i.redd.it/yhzfd960kj7g1.png
IndianStartups,https://old.reddit.com/r/indianstartups/comments/1fypfri/how_much_hard_should_we_work/,4928,723,How much hard should we work 🥺?,,https://i.redd.it/jivdxhxs0gtd1.jpeg
IndianStartups,https://old.reddit.com/r/indianstartups/comments/1jst7t1/the_baniya_startup_culture_of_india_in_a_nutshell/,4484,147,The Baniya Startup Culture of India in a nutshell!!,And these Baniyas are defending the recent government comments,https://i.redd.it/vozauaegm7te1.png
IndianStartups,https://old.reddit.com/r/indianstartups/comments/1kmc3ls/i_hope_one_day_india_will_become_like_usa_and/,3861,176,I hope one day India will become like USA and Russia in this,,https://i.redd.it/y84d6byi9q0f1.jpeg
IndianStartups,https://old.reddit.com/r/indianstartups/comments/1ei5soh/do_you_agree/,3416,39,Do you agree?,,https://i.redd.it/70r1q6hxz7gd1.jpeg
IndianStartups,https://old.reddit.com/r/indianstartups/comments/1g7vnpu/reason_why_i_dont_trust_kamath_brothers/,3382,282,reason why I don't trust Kamath brothers,,https://i.redd.it/pkgkt2da1wvd1.jpeg
IndianStartups,https://old.reddit.com/r/indianstartups/comments/1g71o5q/google_engineer_got_rejected_for_being_too_good/,3250,219,Google engineer got rejected for being too good from a start-up.,,https://i.redd.it/cewwckj3bnvd1.jpeg
IndianStartups,https://old.reddit.com/r/indianstartups/comments/1pfv5wj/love_it_or_hate_it_practically_india_cant_afford/,3139,1041,"Love it or hate it, practically, India CAN'T afford this...","I agree with work-life balance and I agree that 70 hour work week isn't for everyone, but seriously this...
Europe, China, US can afford this - granted, but India?
With politicians leeching the country and feeding people for free with
beti baithke khao yojna
, things have spun out of hand.
Probably Indians are reaching to a point where in the name of work-life balance, they just don't want to work, plain and simple.
China, more populated than India, is beating US when it comes to technology, and they are still following 9-9-6 work culture. Forget about comparison, India is nowhere in that league.
As for India, all we have is, a saree wearing mannequin with a speaker made by 12th grade student, countless ""revolutionary"" chatGPT wrappers, 20 quick commerce players (and more in pipeline) making loss each year, and now a population that wants to be fed for doing nothing. Fantastic!
The politicians and the people both are acting like an
illiterate, stupid, juvenile idiots
.
20 years down the road, ""doomed"" will fall short to describe India's condition if this goes on.
Why don't we just surrender to a superior country right away and cut short this one inevitable ordeal.
Downvote this post or delete it, I can't care less... this is just pathetic.",https://i.redd.it/1qdj5398fm5g1.jpeg
IndianStartups,https://old.reddit.com/r/indianstartups/comments/1eub8yh/whos_right_just_for_laughs/,3085,82,who's right? just for laughs,Truth can't be validated until and unless OP @sde_ray gives more info,https://i.redd.it/t0ir4o5e56jd1.png
IndianStartups,https://old.reddit.com/r/indianstartups/comments/1g8v2x3/left_his_stable_job_to_do_lemon_farming_now_earns/,2863,91,Left his Stable Job To Do Lemon Farming Now Earns 15 Lakh Annually !!,"Leaving a secure high-paying job, and having traveled across parts of the country, when Anand Mishra returned to his small hometown Raebareli to cultivate crops everyone thought he had gone mad. And when he started an experiment with lemon cultivation in the land of wheat and rice people were even more surprised.
In an exclusive interview with Startup Pedia, Mishra shared his journey from being a usual serviceman to becoming the ‘Lemon Man’ of Uttar Pradesh.
Initially, he cultivated the two staple crops, wheat and paddy but soon realized why farmers were unhappy. One hectare of field yielded an annual profit of only ₹ 52,000.
Meeting officials at the District Agriculture Office one fine morning suddenly brought him the idea of lemon cultivation. However, he was clueless at the start as no one could give him the information he needed as before him no one tried cultivating lemons.
Gradually, he started reaping the fruits of his labor. His lemon production flourished and money started pouring in. People in Raebareli as well as throughout Uttar Pradesh fondly started calling him the ‘Lemon Man.’
Today, Lemon Man Anand Mishra is not just a farmer. With an annual turnover of fifteen lakhs, he is a horticulture expert, trainer, and corporate consultant.
When asked if this horticulture business is profitable, Lemon Man confidently replied it sure is. “For lemon cultivation, a farmer can make 2 - 5 Lakhs from 1 acre of land from the 4th year while for traditional it would be only 30-35K annually.”
On asking about the biggest challenge one faces while cultivating lemons, Mishra revealed it was the unavailability of insurance. “Horticulture has no insurance although we are taking huge risks,” Lemon Man laments.
Anand Mishra is confident that anyone can do lemon cultivation.
You can allot a small area for horticulture even while doing a full-time job. It will generate extra income and who does not need some extra money?",https://i.redd.it/dfgceyra75wd1.jpeg
IndianStartups,https://old.reddit.com/r/indianstartups/comments/1k158tc/from_one_cow_to_15_crore_a_yearprakash_nemades/,2724,90,From one cow to ₹1.5 crore a year—Prakash Nemade’s journey is pure rural genius!,"Starting in 1998 with a single cow in Imdevadi village, Solapur, Prakash saw beyond just selling milk. Today, with 150 cows and 1,000 liters of daily milk output, he’s turned dairy farming into a thriving business.
But the real twist? He didn’t stop at milk. Prakash tapped into the growing demand for cow dung, using it for organic farming and biogas production—turning waste into wealth!
With a combined income from milk and dung, he now earns ₹1.5 crore annually, and even built a ₹1 crore dream home called Godhan Nivas.
His story is proof that innovation doesn’t always come from tech—it can come from tradition, when done right.",https://i.redd.it/yt9g79fzybve1.jpeg
IndianStartups,https://old.reddit.com/r/indianstartups/comments/1fxg9ah/kunal_kamra_vs_bhavish_agarwal_whos_right/,2428,582,Kunal Kamra vs Bhavish Agarwal. Who’s right?,,"['https://preview.redd.it/2wqb2q53z4td1.jpg?width=108&crop=smart&auto=webp&s=64cb7e94b0d35f23df51b1e7ecb3d8d25c4d25e6', 'https://preview.redd.it/7pmgup53z4td1.jpg?width=108&crop=smart&auto=webp&s=033d7c320877481c7b1d2622bee638a79f8f53a4']"
IndianStartups,https://old.reddit.com/r/indianstartups/comments/1jvv2p4/piyush_i_heard_your_rant_now_hear_mine/,2396,54,"Piyush , I heard your rant, now hear mine !!!!!!!!",,"['https://preview.redd.it/w1162hzvnzte1.jpg?width=108&crop=smart&auto=webp&s=592cc234215abd57efd186d4952fd0d90293f285', 'https://preview.redd.it/n4vs0pzvnzte1.jpg?width=108&crop=smart&auto=webp&s=266928addad85528e88a5727564d2c7badf3a1df', 'https://preview.redd.it/sfdzyozvnzte1.jpg?width=108&crop=smart&auto=webp&s=c34b4de14e34cceeb96f3c720c7cdc0de12dd4ec', 'https://preview.redd.it/6fv20ozvnzte1.jpg?width=108&crop=smart&auto=webp&s=15c7cb2d04bfc53955d1059948fbd9244c919553']"
IndianStartups,https://old.reddit.com/r/indianstartups/comments/1l4q51d/can_i_also_get_a_job_here_an_auto_driver_in/,2348,49,Can I also get a job here?🙂 An Auto driver in Mumbai is earning Rs 5-8 Lakh a month,,https://i.redd.it/36d3yt9dma5f1.jpeg
IndianStartups,https://old.reddit.com/r/indianstartups/comments/1g6ahoe/byjus_is_worth_zero_today/,2197,259,Byju's is worth zero today,,https://i.redd.it/90zaoysw5gvd1.png
IndianStartups,https://old.reddit.com/r/indianstartups/comments/1piwlx8/supriya_sules_9_to_5_bill_is_awesome_but_lets_be/,2183,153,"Supriya Sule's ""9 to 5 Bill"" is Awesome, but Let's Be Real, This bill probably won't pass.","She introduced a Private Member's Bill that basically tries to set two non-negotiable standards for work in India.
• Formally define the standard work day as 8 hours. No more ambiguity.
• If your boss asks you to work even a minute past those 8 hours, they legally have to pay you at least double your regular salary for that overtime.
It's a ""Private Member's"" Bill: This is the problem. It means it was introduced by an individual MP, not by the ruling government.Pvt Member Bills are essentially non-priority items.It's tough for them even to get debated properly.
I think she knows this bill probably won't pass, but by introducing it, she's putting public pressure on the ruling party to tackle our outdated labor laws.
Eager to listen your opinion 🙏🏼",https://i.redd.it/xeyluxlxxb6g1.jpeg
IndianStartups,https://old.reddit.com/r/indianstartups/comments/1ifu5qt/shutting_down_my_14_months_old_startup_lessons/,2156,284,Shutting down my 14 months old startup!! Lessons learned,"So after 8 years as a product manager, I took the plunge and started up in the Fintech space. 
It's been 14 months and the vision is great but due to internal issues, we are shutting it down. 
Here are my learnings that I hope will help group members here. 
1. Pick your cofounders like you pick your spouse
2. Unresolved conflicts will kill the startup faster than competition 
3. Leadership isn't about titles but it's about action
4. Don't let one person hijack the company direction. Doesn't matter how senior he is
5. Be wary if your cofounder overstates or misleads investors
6. Never rely on verbal agreements 
7. Ensure legal and financial transparency from day one
8. Don't ignore red flags in your co founders. You may think you can work around it but don't even try 
9. Keep a clear paper trail. 
10. Don't work with anyone who lacks integrity.
It's been hard shutting it down after so much of blood and sweat but I have to accept the reality of the situation.
Taking a break now and then back to it again. Job or another startup.. let's see.",
IndianStartups,https://old.reddit.com/r/indianstartups/comments/17mvcjm/whom_do_you_agree_with/,2138,192,Whom do you agree with?,,https://i.redd.it/c0jjcmeaz4yb1.jpg
IndianStartups,https://old.reddit.com/r/indianstartups/comments/1l7115j/what_should_we_do_to_retain_our_bright_minds_in/,2121,594,What should we do to retain our bright minds in India?,,https://i.redd.it/rhwvwx1jmv5f1.jpeg
IndianStartups,https://old.reddit.com/r/indianstartups/comments/1gav10a/did_he_really_did_or_he_is_pretending/,2111,560,Did he really did? Or he is pretending 🤔,How did he worked so fast 🤔or he didn't?,https://i.redd.it/dtu8b2o50nwd1.png
IndianStartups,https://old.reddit.com/r/indianstartups/comments/1p921pt/this_might_go_wrong_for_nikhil_given_musks_bias/,1888,265,This might go wrong for Nikhil given Musk’s bias against India,,https://i.redd.it/oc3c1zphi14g1.jpeg
IndianStartups,https://old.reddit.com/r/indianstartups/comments/1ol11ih/whos_this_are_vcs_this_dumb_do_they_not_do_their/,1851,171,Who's this? 😂😂 Are VCs this dumb? Do they not do their due diligence?,,https://i.redd.it/z525cub6hhyf1.png
IndianStartups,https://old.reddit.com/r/indianstartups/comments/1eqea02/hello_rindianstartups_im_mayank_kumar_co_founder/,1852,633,"Hello r/indianstartups, I’m Mayank Kumar, Co- Founder and MD at UpGrad. Ask me anything about my entrepreneurship journey, overcoming early challenges, and how we built a leading education and skilling platform in India.","AMA
https://preview.redd.it/uu0t8gjym8id1.jpg?width=2988&format=pjpg&auto=webp&s=2935a4f8b5b388a38e66efcf034992c34a946cfd",
IndianStartups,https://old.reddit.com/r/indianstartups/comments/1enr2rp/billionaire_mukesh_ambanis_reliance_industries/,1678,92,"Billionaire Mukesh Ambani's Reliance Industries laid off around 42,000 employees, approximately 11% of its total workforce, in FY24",,https://i.redd.it/xb73i1mijkhd1.png
IndianStartups,https://old.reddit.com/r/indianstartups/comments/1o3o0n1/when_you_commit_fraud_and_dont_pay_your_social/,1640,24,When you commit fraud and don’t pay your social media team,,https://i.redd.it/9vjj13hhbfuf1.jpeg
IndianStartups,https://old.reddit.com/r/indianstartups/comments/1ga6sf1/2_brothers_from_haryana_growing_saffron_in_just/,1621,43,2 Brothers From Haryana Growing Saffron in just 225 sq ft room..!!,"In Haryana, brothers Naveen and Praveen Sindhu have turned a 225 sq ft room into a successful saffron farm, selling the world's costliest spice for ₹5 lakh per kg.
Their journey began when Praveen, while pursuing his MTech, read about indoor saffron farming. After training in Thailand and visiting Pampore, Kashmir, they decided to cultivate saffron at home.
In 2018, they converted an unused room on their roof for this purpose, using aeroponics—a method that allows plants to grow in air or mist without soil.
They invested around ₹6 lakh to set up the lab, purchasing saffron bulbs from Kashmir. Despite initial setbacks with damaged seeds, they persevered and successfully harvested 2 kg of saffron in one season, earning ₹10 lakh.
The brothers carefully manage the growing conditions with temperature control, humidity, and grow lights.
They plant saffron bulbs in August and harvest the flowers in November. After harvesting, they can use the bulbs again for future planting, reducing costs significantly.
Their brand, Amaratva, not only caters to the domestic market but also exports to countries like the US and UK. By diversifying their farming with mushrooms during off-seasons, they continue to increase their earnings.",https://i.redd.it/u77zzbfibhwd1.jpeg
IndianStartups,https://old.reddit.com/r/indianstartups/comments/1gbluvk/indias_leading_quick_commerce_company_zeptos_ceo/,1616,462,India’s leading quick commerce company Zepto’s CEO Aadit Palicha recently admitted that the employees in his company work 80 to 100 hours a week,,
IndianStartups,https://old.reddit.com/r/indianstartups/comments/1f6zxwr/do_you_agree_with_his_viewpoint/,1464,134,Do you agree with his viewpoint?,,https://i.redd.it/f0y08hzuacmd1.jpeg
IndianStartups,https://old.reddit.com/r/indianstartups/comments/1nqxr86/rbi_cracks_down_on_bengaluru_startup_simpl_orders/,1446,220,"RBI cracks down on Bengaluru startup Simpl, orders immediate halt of payment operations.","The Reserve Bank of India (RBI) has issued a directive to Bengaluru-based fintech startup Simpl, asking it to immediately halt all payment operations. The central bank cited violations of the Payment and Settlement Systems (PSS) Act, 2007, stating that Simpl was running a payment system without the required Certificate of Authorisation.
Simpl, known for its buy-now-pay-later (BNPL) services, works with major platforms like Zomato, BigBasket, Rapido, and Box8. This action raises big questions about compliance and oversight in India’s growing fintech startup ecosystem.
What’s your take — Is RBI being too strict, or is this a necessary step to regulate fintech startups properly?",https://i.redd.it/l3o1bkbikhrf1.png
IndianStartups,https://old.reddit.com/r/indianstartups/comments/1jxbd64/another_case_of_ease_of_doing_business_that_the/,1417,84,"Another case of ""ease of doing business"" that the govt likes to rant about",,https://i.redd.it/hhmlabweqcue1.jpeg
IndianStartups,https://old.reddit.com/r/indianstartups/comments/1mzpr8x/i_saw_nikhil_kamath_yesterday_he_waved_hi_to_me/,1402,125,I saw Nikhil Kamath yesterday. He waved hi to me. And I gave him this note.,"I was at Bandra Subko Cafe to meet a VC friend.
At first, I was just sitting on the first floor.
He walked in and said:
“Bro, this is too cramped. Let’s go to the top floor, it’s more comfortable.”
So we went upstairs, ordered food, and started talking.
He was breaking down how VCs think, how to pitch, why storytelling matters, how clarity in your head has to translate into clarity in your pitch.
Honestly, I was just soaking it all in.
While he was talking, I noticed a group of people walk into the private room right in front of us.
From the corner of my eye, I realised:
“F***. That’s Nikhil Kamath sitting there.”
I didn’t want to interrupt because his advice was gold.
But the moment he paused, he also noticed:
“Bro, Nikhil Kamath is sitting there!”
We were both starstruck.
Then he asked me:
“Do you have any business material on you?”
Me: “No card, nothing.”
Then I remembered: “Wait, I have my diary.”
He didn’t even think twice:
“Do it right now. You have to take all the chances you get.”
So I pulled out my diary, scribbled a quick handwritten note about what I’m building (BeHooked), tore the page, and folded it neatly.
We were lucky our table was right in front of the door to that room. Otherwise, this moment would never have happened.
I didn’t want to interrupt his group, so I asked the waiter to pass it along. The staff was super nice, they delivered it to him.
And then Nikhil read it carefully. He looked up, smiled, and waved at me.
That 2-second wave made the entire day worth it.
If we hadn’t moved to the top floor, none of this would have happened.
Take your shots. You never know which one will land.
I really think this could turn into something. Let’s hope for the best.
https://preview.redd.it/5flukwg6y5lf1.jpg?width=1576&format=pjpg&auto=webp&s=e0144b5ab2b80db39ded28d87210da9b6d2edee8",
IndianStartups,https://old.reddit.com/r/indianstartups/comments/1fwjaai/ai_startup_culture_is_this_level_of_intensity/,1384,105,"AI startup culture, Is this level of intensity sustainable?",,https://i.redd.it/2wojh1gbivsd1.png
IndianStartups,https://old.reddit.com/r/indianstartups/comments/1etg5rj/rapido_generated_70_lakh_jobs_in_its_nine_years/,1337,108,Rapido generated 70 lakh jobs in its nine years of operations,,https://i.redd.it/0489pr7mhyid1.png
IndianStartups,https://old.reddit.com/r/indianstartups/comments/1f8nbip/indias_wealthiest_under_the_age_of_35/,1326,155,India's wealthiest under the age of 35.,,https://i.redd.it/9mifkib3wqmd1.jpeg
IndianStartups,https://old.reddit.com/r/indianstartups/comments/1eqz9jq/mapmyindia_ceo_on_ola_maps/,1326,95,MapMyIndia CEO on Ola Maps,,https://i.redd.it/hgsd4qvq2did1.png
IndianStartups,https://old.reddit.com/r/indianstartups/comments/1f8l09j/peak_bengaluru_moment/,1321,37,Peak Bengaluru Moment,,https://i.redd.it/7j6yqtsa4qmd1.png
IndianStartups,https://old.reddit.com/r/indianstartups/comments/1jo68tr/india_lacking_innovation_investors_promoting/,1305,142,"India lacking innovation, Investors promoting businesses rather than Creativity!!",Your thoughts on this?,https://i.redd.it/9cecj7fpp1se1.jpeg
IndianStartups,https://old.reddit.com/r/indianstartups/comments/1ewntvs/education_has_become_unaffordable_due_to_costly/,1246,30,Education has become unaffordable due to costly real estate: Zoho CEO,,https://i.redd.it/7py9qto8arjd1.jpeg
IndianStartups,https://old.reddit.com/r/indianstartups/comments/1k16f98/bitter_reality_make_in_india_was_a_lie_that_the/,1214,176,"Bitter Reality: ""Make in India"" was a Lie that the Gov kept repeating to mask the Actual Trade deficit year after year.","The bitter fact is India has substantially more dépendance on China than what it had 10 years ago.
If you read the article, Our exports to China have acutally shrunk by 14.5%.
This is also a masisve L in losing Leverage from a Geopolitical POV if you ask me.
Trumps Indian tarrifs don't even come remotely close to a hypothetical scenario where China decides to slap tarrifs on India.
But Jo hoga woh dekha jaega, I guess.
For now let's just enjoy our ride on the  Rupee-Slide until we reach the ""Historic"" 100 mark. 🫠",https://i.redd.it/0wesfhpbdcve1.jpeg
IndianStartups,https://old.reddit.com/r/indianstartups/comments/1f31i0s/all_the_inspiration_you_need/,1210,38,All the inspiration you need,,https://i.redd.it/n97vd1pu1cld1.png
IndianStartups,https://old.reddit.com/r/indianstartups/comments/17y3592/ashneer_deleted_this_tweet_soon_after/,1195,52,Ashneer deleted this tweet soon after 😂😂,,https://i.redd.it/yr32o931w21c1.jpg
IndianStartups,https://old.reddit.com/r/indianstartups/comments/1ekrsue/indias_answer_to_autonomous_driving/,1124,126,India’s answer to autonomous driving!,"This Bhopal based autonomous driving startup has secured $4 million in funding from US based angel investors. , boosting its valuation to $151 million and driving its mission to Level 5 autonomous vehicle technology.",
IndianStartups,https://old.reddit.com/r/indianstartups/comments/1g2j0ne/raj_in_a_blunt_statement_referred_to_bihar_as_the/,1090,103,"Raj, in a blunt statement, referred to Bihar as “the land of frustration,” calling his decision to establish the company there “the worst decision” of his life",,https://i.redd.it/wou07de2qgud1.png
IndianStartups,https://old.reddit.com/r/indianstartups/comments/1ko2ah0/suicide_due_to_work_pressure_at_the_ola_the_worst/,1076,129,"Suicide due to work pressure at the OLA, the worst place to work","Not sure why its not a public issue yet, a colleague of mine just gave up on his life due to extreme work pressure. He used to work in Krutrim, and with 2 other guys leading a project(even after being a freshie). The other two guys left the company, so he was cramped up with work of the other two as well. I shouldn’t be taking names but this absolute shit of a manager Rajkiran Panuganti has no real clue how to man manage people. He just attends the calls, bashes people left, right and center and disappears since he lives in US and most workforce is here in Bangalore. The words used in meetings, especially against freshers, its just traumatic. Having not delivered a single product even after a year of joining Krutrim, he is just taking it all out on people. Even after this shocking incident, there has been no behavioural change in people there. I heard other team members saying if they stay anymore here, they are going to end up doing the same. The authorities are trying their best to shut down the news. Its pathetic to be honest. Hope this blows up and police takes strict action. Didn’t know where else to share this, but here we go.",
IndianStartups,https://old.reddit.com/r/indianstartups/comments/1ff08xm/9_mistakes_that_kill_startups/,1060,40,9 mistakes that kill startups,,https://i.redd.it/w15fsca46dod1.png
