subreddit,permalink,score,num_comments,title,body_text,image_url
IndianStartups,https://old.reddit.com/r/indianstartups/comments/1naon4k/its_been_17_years_yet_flipkart_has_made_zero/,1039,83,"It’s been 17 years, yet Flipkart has made zero profits","Honestly wild to think about. Flipkart’s been around since 2007, raised billions, and is still in the red. On one hand, it shows how insanely hard e-commerce is in India with razor-thin margins, crazy logistics costs, and constant price wars. On the other, it makes you wonder how long “growth over profit” can be stretched before it stops making sense.",
IndianStartups,https://old.reddit.com/r/indianstartups/comments/1f1gm6x/i_am_best_excluding_everyone/,1035,52,I am best excluding everyone,,
IndianStartups,https://old.reddit.com/r/indianstartups/comments/1f5fp4x/bengalurus_startup_ecosystem_similar_to_kotas/,993,44,Bengaluru’s startup ecosystem similar to Kota’s coaching culture?,,https://i.redd.it/vx7cqo3nnxld1.png
IndianStartups,https://old.reddit.com/r/indianstartups/comments/1fzmsxy/in_new_india_youth_low_paid_slave/,965,129,"In new India, youth = low paid slave","In new India, being nationalist = become low paid slave",https://i.redd.it/pzo6p9x01ptd1.jpeg
IndianStartups,https://old.reddit.com/r/indianstartups/comments/1g9c73k/were_fortunate_to_have_a_government_that_supports/,958,200,We're Fortunate To Have A Government That Supports Innovation.. : Zepto CEO !!,"Zepto CEO Aadit Palicha has lauded PM Modi for building a strong atmosphere that benefits the startup ecosystem's growth.
At the NDTV World Summit, Aadit Palicha said, ""This is India's century. Thanks to the government's work in providing the infrastructure needed to build such exceptional companies, we are working hard to create impactful businesses in India that will employ hundreds and thousands of people and contribute to the country's economy.""
He expressed his optimism about the conducive environment for Indian startups and said, ""We're fortunate to be in a country with immense opportunities and a government that supports innovation. Most of the startup ecosystem has flourished in the past decade, from 2012 to 2024.""
He further said, ""India is well on its way to achieving this in the next 20 to 25 years. We're glad to see representation for tech startups and hope to encourage more entrepreneurs to start technology companies in India. This growth will benefit everyone.”
Palicha pointed to the emergence of high-quality companies in public markets, explaining that this success is a result of investments, technological advancements, and initiatives like digital public infrastructure.",https://i.redd.it/sqw0ev8kb9wd1.jpeg
IndianStartups,https://old.reddit.com/r/indianstartups/comments/1nwne7a/arattai_messaging_app_overtakes_global_giants_can/,945,279,"Arattai messaging app overtakes global giants, Can it sustain the momentum? 🤔","Union Minister Piyush Goyal has endorsed Zoho’s homegrown messaging app Arattai, calling it a true Swadeshi product that brings India closer. In a post on X, Goyal wrote that nothing beats the feeling of using a Swadeshi product, while announcing that he and his team have joined the platform. His remarks come as Arattai surges in popularity, climbing to the top of Apple’s App Store social networking chart and overtaking giants like WhatsApp and Telegram. The app, launched in 2021 by Zoho, has seen explosive growth in recent days, with daily sign-ups skyrocketing from just 3,000 to over 3.5 lakh. Founder Sridhar Vembu revealed that Zoho is rapidly scaling its infrastructure to handle the sudden spike, while also preparing for another possible 100x surge in traffic. The momentum has sparked conversations about whether Arattai could truly become India’s answer to global messaging platforms.",https://i.redd.it/k35mxdb86tsf1.png
IndianStartups,https://old.reddit.com/r/indianstartups/comments/1oaq5rj/how_did_they_do_it_isnt_it_unethical_to_get_cab/,929,91,"How did they do it, isnt it unethical to get cab prices in real time........",,https://i.redd.it/lj2eyqqup2wf1.png
IndianStartups,https://old.reddit.com/r/indianstartups/comments/1g8hctv/kunal_kamra_has_once_again_taken_a_dig_at_bhavish/,933,74,Kunal Kamra has once again taken a dig at Bhavish Aggarwal,,https://i.redd.it/ssj76hfbc1wd1.png
IndianStartups,https://old.reddit.com/r/indianstartups/comments/1f1g1jq/the_process_and_challenges_of_earning_rs_20_as_a/,930,124,The process and challenges of earning Rs 20 as a Zomato delivery boy,,
IndianStartups,https://old.reddit.com/r/indianstartups/comments/1fxl15i/is_it_fair_to_ask_delivery_partners_to_use/,907,131,Is it fair to ask Delivery partners to use service lifts?,,https://i.redd.it/5qhj7jhx16td1.jpeg
IndianStartups,https://old.reddit.com/r/indianstartups/comments/1n6eyra/nikhil_kamath_guy_has_now_raised_6_crores_wtf/,894,29,Nikhil Kamath Guy has now raised 6 crores WTF!!!!!,"Is this what it takes to raise capital, just coverage from news media and you get investors",https://i.redd.it/jcpfmnzu0qmf1.jpeg
IndianStartups,https://old.reddit.com/r/indianstartups/comments/1jwoda9/thoughts_on_this_after_many_entrepreneursfounders/,862,48,Thoughts on this.... after many entrepreneurs/founders reacted to this,,"['https://preview.redd.it/369qjqqf67ue1.jpg?width=108&crop=smart&auto=webp&s=d817995afc77e663eda9819f840f9e8c08eceb55', 'https://preview.redd.it/162v5gyf67ue1.jpg?width=108&crop=smart&auto=webp&s=ab23181f5c5494c532a9188836c9c967557c83e9', 'https://preview.redd.it/u5s5434g67ue1.jpg?width=108&crop=smart&auto=webp&s=39ce31c343ad6562050cdd9ca9d1cc860bdc6e84', 'https://preview.redd.it/xmsdmh8g67ue1.jpg?width=108&crop=smart&auto=webp&s=2c967ff05daacf367dc6fe9340940b6db8b39b4b', 'https://preview.redd.it/v2l41ceg67ue1.jpg?width=108&crop=smart&auto=webp&s=250961e5c1fffe8bfae7e975bfc156314e29d673', 'https://preview.redd.it/jgzbpmkg67ue1.jpg?width=108&crop=smart&auto=webp&s=935e7aff0073f1ea7116749294ded2936a9ef0a4', 'https://preview.redd.it/bonbz2pg67ue1.jpg?width=108&crop=smart&auto=webp&s=b1703a9c89d1de1e966b8cbe14ee47d93601f274', 'https://preview.redd.it/fw27hytg67ue1.jpg?width=108&crop=smart&auto=webp&s=96678ddca0cdf561ffc2c7f6828ff1d8c899aba3', 'https://preview.redd.it/ffagk8zg67ue1.jpg?width=108&crop=smart&auto=webp&s=76e74d0d898b0d22af9c1db32badf144dcaabe12']"
IndianStartups,https://old.reddit.com/r/indianstartups/comments/1f29ehi/from_13000_to_5300_croresarun_ice_creams_proves/,857,52,"From ₹13,000 to ₹5,300 crores—Arun Ice Creams proves that innovation and hard work can conquer any market !!!",,https://i.redd.it/rea9qsuq65ld1.jpeg
IndianStartups,https://old.reddit.com/r/indianstartups/comments/1l1aw7r/this_is_crazy_zepto_cafe_banned_due_to_hygiene/,858,31,"This is Crazy, Zepto Cafe banned due to hygiene????",,https://i.redd.it/cb4rcf8pjg4f1.jpeg
IndianStartups,https://old.reddit.com/r/indianstartups/comments/1emwwlu/indians_clock_in_the_longest_average_work_week/,849,129,Indians clock in the longest average work week among the world's top 10 economies,,https://i.redd.it/vkuwje61bdhd1.png
IndianStartups,https://old.reddit.com/r/indianstartups/comments/1kjtlit/a_wakeup_call_for_all_indian_startups_we_must_do/,838,181,"A wake-up call for all Indian startups, we must do better.","These past few days have made me contemplate my startup journey and question whatever I am building. If India was as strong as China militarily, economically Pakistan wouldn't even have dared to pull off a terror attack. USA wouldn't have the power to pressure India into a ceasefire. India could have choked Pakistan without firing a shot. Also, our ministers and spokespersons would not have the necessity to go on to international media to gain advantage over Pakistan in information battle. Forget setting international narratives right, our own people were getting information from twitter, reddit, YouTube and whatnot (none of them Indian) the government had to go and reach out to the platforms to block certain content and accounts from spreading misinformation. India definitely needs a social platform, if not international at least national, like Chinese. It's a shame that our local city governing bodies had to buy twitter premium and issues alerts and pass on info to its own citizens through these networks, where do you think USA gets its intelligence for its agencies from? (facebook, instagram, x, google, apple, android, windows, etc etc)
Despite all the work in diplomacy by our foreign minister from the past decade, we had no real powers rallying behind us for justice against terrorism, no sanctions or any serious repercussions against Pakistan (the IMF loan in the middle was a serious blow), It just shows how we are left for ourselves to defend our lands, tomorrow if China comes in and tries anything in India, the world won't speak a word, they have all the rare earth metals yk.
The S400 systems that we all hail and praise, were built and tested by Russia in 1999, in 1999!!!!!, 26 years later, so many batches of IITians later and PHDs who went and researched in top tech in the west later, we have nothing remotely close to it, Even Iran has home built superior air defense systems and hypersonic missiles(used against us yesterday) despite under deep western sanctions, don't even talk about fighter jets, we just spend billions and buy whatever is available, despite knowing, export variations of the jets from any country are inferior to their own home jets. We know full well that countries can and will withhold weapons in a time of need for India. In the event of war, if Russia, USA or France for that matter decide to not sell any weapons/defense for us, we are truly f**ed.
I have huge respect for our army. 80 Billon Dollars(6 lack 80 thousand CRORE rupees!) is our Defense spending. why are there not a lot of startups building things for the Army? why does it always have to be DRDO, that does the military research? Are we not dreaming big enough? My work and company is no less important than yours and your contribution for the country, but there definitely is a lot of nobility and sense of pride when building for our nation and her security. Anyways, it's just a thought, you all have a great day!",
IndianStartups,https://old.reddit.com/r/indianstartups/comments/1fh4uf8/launched_in_2023_digital_labour_chowk_is_a/,827,34,"Launched in 2023, Digital Labour Chowk is a Noida-based startup that has innovated India's first online job portal for blue-collar workers in India. It aims to replace the conventional physical labour chowks in the country",,https://i.redd.it/yhr81nd7nwod1.png
IndianStartups,https://old.reddit.com/r/indianstartups/comments/1kn4yv6/this_is_the_answer_for_those_indians_who_have/,827,58,This is the answer for those Indians who have made Trump a God🤡,,https://i.redd.it/7ahuezczbx0f1.jpeg
IndianStartups,https://old.reddit.com/r/indianstartups/comments/1exi9ih/how_does_one_get_this_level_of_grand_delusion/,819,192,How does one get this level of grand delusion,"I mean, it’s okay to be cocky but being a perpetual thief and liar and then taking digs at achievers is some massive level of grand delusion",https://i.redd.it/owxqavr0lyjd1.jpeg
IndianStartups,https://old.reddit.com/r/indianstartups/comments/1fa6rsu/rapido_becomes_indias_latest_unicorn_with_11/,810,42,Rapido becomes India's latest unicorn with $1.1 billion valuation,,https://i.redd.it/tji71sssa4nd1.png
IndianStartups,https://old.reddit.com/r/indianstartups/comments/1lk5l1p/shark_tank_india_trolling_ceos_for_shark_tank/,795,11,Shark tank india trolling CEOs for Shark tank India season 5,,
IndianStartups,https://old.reddit.com/r/indianstartups/comments/1fgeubr/most_iconic_startup_acquistion/,787,46,Most Iconic Startup Acquistion,,https://i.redd.it/k5z4lgtzkpod1.png
IndianStartups,https://old.reddit.com/r/indianstartups/comments/1gasoiq/can_this_be_true/,772,79,Can this be True?,Is it even possible for the  issues pending for more than 1 year to be solved in 15 days?,https://i.redd.it/n418yetybmwd1.jpeg
IndianStartups,https://old.reddit.com/r/indianstartups/comments/1f7au3g/this_is_just_the_beginning/,776,52,This is just the beginning...,"It gets better:
""The district consumer disputes redressal commission has ordered Ola Electric to pay INR 50,000 in compensation to a Sundargarh district resident for deficiency in service and mental agony. The company must refund the e-scooter's cost or replace it with a new one, and pay INR 10,000 in legal costs within 30 days.""
Looks like time to pay the dues has come.",https://i.redd.it/rfoofaix8fmd1.jpeg
IndianStartups,https://old.reddit.com/r/indianstartups/comments/1ez42sq/bhavish_aggarwal_said_that_elon_musk_should_stop/,774,296,Bhavish Aggarwal said that Elon Musk should stop entering the same businesses he is involved in,,https://i.redd.it/fbpeuogieckd1.png
IndianStartups,https://old.reddit.com/r/indianstartups/comments/1fjkn6f/what_are_your_thoughts/,764,220,What are your thoughts?,,https://i.redd.it/23x46xacyhpd1.png
IndianStartups,https://old.reddit.com/r/indianstartups/comments/1g0dw70/what_do_u_think/,761,84,What do u think?,,https://i.redd.it/kjm4kin40wtd1.jpeg
IndianStartups,https://old.reddit.com/r/indianstartups/comments/1koohn8/because_of_this_this_country_will_go_backwards/,751,196,"Because of this, this country will go backwards instead of moving ahead.",,https://i.redd.it/9oc69w6g3b1f1.jpeg
IndianStartups,https://old.reddit.com/r/indianstartups/comments/1f3u3il/swiggy_ceo_sriharsha_majety_revealed_that_the/,743,44,Swiggy CEO Sriharsha Majety revealed that the company did not receive any orders on its first day,,https://i.redd.it/rtyck5e59jld1.png
IndianStartups,https://old.reddit.com/r/indianstartups/comments/1erub9p/top_10_profitable_startups_of_india/,747,103,Top 10 Profitable Startups of India,,https://i.redd.it/d2ks2lcwmkid1.png
IndianStartups,https://old.reddit.com/r/indianstartups/comments/1ekfejo/how_lenskart_makes_money/,728,72,How lenskart makes money,,https://i.redd.it/q2no5ezn0sgd1.png
IndianStartups,https://old.reddit.com/r/indianstartups/comments/1gdbiae/what_is_going_to_be_the_next_social_media_app/,723,222,What is going to be the next social media app?,"Starting from facebook till instagram, twitter and snapchat, we have covered all, text,images,videos. What is going to be the next big thing? How are social media platforms gonna evolve in the next decade? Do you have any idea on the next big social media platform.
Edit:
My understanding is that the globalisation era needed social media for people to connect worldwide, share connections cultures and form communities across. Ofcourse dating and sex have always been hidden driving force behind every internet sensation and will continue to do so. Then there are social hierarchies, sense of identity and belonging. Whoever is building the next platform needs to think of all these factors that contributed to the growth of these apps that exist today.",
IndianStartups,https://old.reddit.com/r/indianstartups/comments/1f4kovr/zepto_gets_another_round_of_funding_340_million/,716,182,"Zepto gets another round of funding, $340 million this time. What is attracting investors to Zepto?",,https://i.redd.it/m4pv021urpld1.jpeg
IndianStartups,https://old.reddit.com/r/indianstartups/comments/1em2t8q/zomato_collected_inr_83_cr_in_platform_fee/,720,95,Zomato Collected INR 83 Cr in Platform Fee,,https://i.redd.it/xq3ayyee66hd1.png
IndianStartups,https://old.reddit.com/r/indianstartups/comments/1ewp66l/lut_gaye_hum_toh_ola_lekar_ke_customer_singing/,717,14,Lut Gaye Hum Toh OLA Lekar Ke - Customer Singing,,
IndianStartups,https://old.reddit.com/r/indianstartups/comments/1feuqak/customer_sets_ola_electric_showroom_on_fire_after/,716,75,Customer sets Ola Electric showroom on fire after growing frustrated with unresolved issues related to his electric scooter,,
IndianStartups,https://old.reddit.com/r/indianstartups/comments/1f675pf/blue_tokai_raises_rs_293_crore_in_a_series_c/,710,43,Blue Tokai raises Rs 293 crore in a Series C funding round,,https://i.redd.it/j1yf4tdmw4md1.png
IndianStartups,https://old.reddit.com/r/indianstartups/comments/1nujl5q/indias_most_profitable_startups_revealed_groww/,704,54,"India's most profitable startups revealed! Groww leads ₹1,824 cr club, Myntra, Indiamart digit join elite list as 202 companies achieve ₹100+ cr revenue",,https://i.redd.it/8fjuwh468csf1.jpeg
IndianStartups,https://old.reddit.com/r/indianstartups/comments/1ksjy6z/my_vc_friend_gave_me_a_mental_model_that/,691,125,My VC Friend Gave Me a Mental Model That Instantly Filtered Out 90% of Startup Ideas,"I was at the gym chatting with a VC friend. I mentioned to her a buddy of mine who just launched a soap startup for people with sensitive skin and I asked her, “Would you invest in something like that?”
She immediately said no, not because the product was bad or the founder wasn’t capable. Her reason was simple and it was: The product doesn’t get better with more people use it.
She explained that great startup ideas usually have some built-in compounding advantage (in terms of product feature, not cost). Something that makes the product stronger, or smarter as more people use it.
Soap doesn’t do that. You sell it, that’s it, it doesn’t improve with use or unlock new value at scale.
The problem is when founders take VC money to sell cheap and grow fast, but later investors want profits. So prices go up. Then a new startup comes in with fresh funding and undercuts them. Rinse and repeat. Especially in markets like India, where anyone can white-label a similar product and compete on price.
Her advice was clear and honest, it’s one of the simplest yet powerful mental models I’ve heard on judging startup ideas:
If your product doesn’t get better with more users, think twice before treating it like a startup. Maybe it’s just a solid business. And that’s perfectly okay.",
IndianStartups,https://old.reddit.com/r/indianstartups/comments/1ad7etf/anyone_here_who_uses_meesho_over_flipkartamazon/,696,259,Anyone here who uses Meesho over Flipkart/Amazon?,Am I the only one not using it ?,https://i.redd.it/z8te5pcyq7fc1.jpeg
IndianStartups,https://old.reddit.com/r/indianstartups/comments/1exgzlc/my_brother_personally_gave_1600_crore_to_pay/,676,91,"My brother personally gave ₹1,600 crore to pay BYJU'S staff: Byju amid delay in salary!!!",,https://i.redd.it/ce7nmlqw6yjd1.jpeg
IndianStartups,https://old.reddit.com/r/indianstartups/comments/1fuz5nf/zerodha_hired_only_5_employees_for_its_technology/,648,80,Zerodha hired only 5 employees for its technology team in 4 years,,https://i.redd.it/pl0ry23dsgsd1.png
IndianStartups,https://old.reddit.com/r/indianstartups/comments/1fe5zpy/what/,645,40,What? 🤦🏼‍♂️,"He shot his own foot by doing this. Ola doesn't really care about losing 1 showroom, their insurance will probably safeguard them.
But this guy ended his whole future. He should have tried protesting like the guy who sang in front of showroom or something.
Anyways, Ola EV and their after-service apparently sucks.",https://i.redd.it/zxdjekpwf5od1.png
IndianStartups,https://old.reddit.com/r/indianstartups/comments/1eiy2dh/what_is_that_f/,647,152,What is that F?🤔,,https://i.redd.it/efbmu968qegd1.png
IndianStartups,https://old.reddit.com/r/indianstartups/comments/1l5pquk/street_seller_making_180000_inr_monthly_by/,644,65,"Street Seller Making 180,000 INR Monthly By Selling Pani-Puti 🥲","I live in Sector 24 Gurugram.
Last week I asked a pani-puri seller how much he makes daily.
He told me he makes around 4k - 5k INR
My friend said “Bhaiya itna bhi mat pheko”
He opened his phonepay app and showed us that he is making around 150k INR monthly.
And I got shocked after I asked how much he invests monthly.
He said 30k ( including rent + groceries + materials )
That day my friend and I didn't sleep.
We were so embarrassed in front of that guy.
I couldn't even explain.
Dude!",
IndianStartups,https://old.reddit.com/r/indianstartups/comments/1kju7ox/how_much_time_will_it_to_have_a_ecosystem_like/,646,82,How much time will it to have a ecosystem like this in india,As of now majority of contractor in india are PSUs,https://i.redd.it/8e0ia4jsg30f1.jpeg
IndianStartups,https://old.reddit.com/r/indianstartups/comments/1krzt2j/dont_touch_indian_startups_unless_you_want_to_be/,640,49,Don’t Touch Indian Startups Unless You Want to Be Managed by Sales Bros and IIT Egos,"Most managers here have a sales background which in the Indian corporate context often translates to loud, clueless, and obsessed with optics over actual work. Then you’ve got senior engineers, mostly ex-IIT or NIT. No offense, but I’ve yet to meet one who didn’t flex their college badge within two minutes of conversation. That’s not an achievement, that’s arrested development.
Their entire personality revolves around a college entrance exam they cracked a decade ago. And because of that, they walk around with the delusion that anyone from a “lesser” college is intellectually inferior. The arrogance is unbearable, and it trickles down into the work culture rigid, toxic, and elitist.
Take Ola, Zepto, or Zomato, pick your poison. A guy working at Ola’s AI wing literally killed himself from the pressure. Zomato canned over 300 employees for the crime of being slightly late. Not after warnings, not after reviews just out. No empathy, no support. It’s not just mismanagement. It’s inhumane.
Indian startups love slogans like “building for Bharat,” but internally, they’re sweatshops in hoodies. Avoid them unless you’re into career masochism.
P.S.: Had to use ChatGPT for fixing grammar mistakes.",
IndianStartups,https://old.reddit.com/r/indianstartups/comments/1nv5por/lahori_zeera_started_by_3_brothers_in_2017_has/,633,51,"Lahori Zeera, started by 3 brothers in 2017, has grown into a ₹530 CR desi thanda giant",,https://i.redd.it/tk44cdbxkhsf1.jpeg
IndianStartups,https://old.reddit.com/r/indianstartups/comments/1nipbd1/i_got_my_first_celeb_order_during_ganesh_chaturthi/,638,25,I got my first celeb order during Ganesh Chaturthi,"Soooo, Ahsaas Channa placed an order a month back but i recently got a good review for it! Please guys nazar mat lagana .
I actually died when i saw that she ordered, i literally thought it's fake till she said it's not. Maybe it's a small thing but idk i love her and like an easter egg, she ordered during Ganesh Chaturthi.
(i have also uploaded a video on my profile if anyone wants to see me fan girling)",https://i.redd.it/yv3y50i2jkpf1.png
IndianStartups,https://old.reddit.com/r/indianstartups/comments/1ku8jjz/india_is_planning_to_allow_foreign_firms/,619,45,"India is planning to allow foreign firms including from US, to bid for government contracts on reciprocal basis.",,https://i.redd.it/e8jqeetfjp2f1.jpeg
IndianStartups,https://old.reddit.com/r/indianstartups/comments/1g43qql/bhavish_aggarwal_chilling_at_a_cafe_in/,619,104,Bhavish aggarwal chilling at a cafe in Indiranagar on a sunday afternoon. Thought he works 24/7 ??,,https://i.redd.it/a49433fh3wud1.jpeg
IndianStartups,https://old.reddit.com/r/indianstartups/comments/1f0qmat/bc_thought_of_this_when_i_was_in_class_7th/,618,46,Bc thought of this when I was in class 7th 🫡,,https://i.redd.it/hcu9qtnifrkd1.jpeg
IndianStartups,https://old.reddit.com/r/indianstartups/comments/1env3lp/foreign_attempt_to_buy_indias_haldirams_offer_usd/,592,33,Foreign Attempt To Buy India's Haldiram's. Offer - USD 8.5 Billion For 76%.,,https://i.redd.it/1i3m4whbulhd1.jpeg
IndianStartups,https://old.reddit.com/r/indianstartups/comments/1941pue/need_cofounder_to_do_everything/,165,34,Need cofounder to do everything,"I’ve business guy and thought of the strtup idea so i get 90%. You do all work. No salary, If we are successful , i will give u some money (depends on mood). I want tech person to make a game like gta6 but with made in india. Im ready to put 1500rs for this. I will name the idea “India startup gta”.
Im Solving problems of real bharat, just need someone to do all the tasks for me. Looking for student developer so i can exploit fully.
After this is built , next we build like contra strike and everything. I know my local cybercafe so i am market it there by giving it for free to them.
Qualifications:
10 yr industry experience
Btech
Mba
Graphic design
Video editing
Sales
Marketing
Anything else that will be required for billion dollar startup
Something is brewing🥴😛🤪😜🥵🥵🥴",
